visitor_id,account_id,first_visit_at,visitor_id_hash,last_browser_name,last_browser_version,last_operating_system,last_server_name,last_updated_at,last_user_agent,last_visit,n_id,_fivetran_synced,latest_visitor_index,count_associated_accounts,latest_nps_rating,count_active_days,count_active_months,sum_minutes,sum_events,count_event_records,average_daily_minutes,average_daily_events,first_event_on,last_event_on
mountain_neighbouring,assemblies_class,2020-06-16 02:29:44.583,138531682,Safari,13.1.1,iOS,fivetran.com,2021-06-19 12:11:50.426,"Mozilla/5.0 (iPhone; CPU iPhone OS 13_5_1 like Mac OS X) AppleWebKit/605.1.15 (KHTML, like Gecko) Version/13.1.1 Mobile/15E148 Safari/604.1",2020-06-16 02:29:44.583,,2021-06-19 20:11:31.575,1,,,0,0,0,0,0,0,0,,
confident_face,_etc_acc,2020-09-21 19:13:48.511,2170177977,Chrome,85.0.4183,Mac OS X,fivetran.com,2020-12-12 13:08:24.366,"Mozilla/5.0 (Macintosh; Intel Mac OS X 10_15_6) AppleWebKit/537.36 (KHTML, like Gecko) Chrome/85.0.4183.102 Safari/537.36",2020-09-21 19:24:20.800,,2020-12-12 20:29:56.014,1,,,0,0,0,0,0,0,0,,
straddle_cloud,comedy_cras,2020-11-28 22:33:37.543,2832249180,Chrome,87.0.4280,unknown,fivetran.com,2020-12-26 13:08:51.907,"Mozilla/5.0 (Macintosh; Intel Mac OS X 11_1_0) AppleWebKit/537.36 (KHTML, like Gecko) Chrome/87.0.4280.88 Safari/537.36",2020-12-24 09:48:01.952,,2020-12-26 20:09:23.528,1,,,0,0,0,0,0,0,0,,
river_deep,famous_modification,2020-05-17 02:47:28.537,425871239,Chrome,88.0.4324,Windows,fivetran.com,2021-04-15 12:12:43.819,"Mozilla/5.0 (Windows NT 10.0; Win64; x64) AppleWebKit/537.36 (KHTML, like Gecko) Chrome/88.0.4324.146 Safari/537.36",2021-02-08 15:56:06.699,,2021-04-15 20:11:27.812,1,,,0,0,0,0,0,0,0,,
mountain_high,clumsy_tentacle,2021-01-12 16:46:58.278,163325431,Chrome,89.0.4389,Mac OS X,fivetran.com,2021-03-30 22:33:09.528,"Mozilla/5.0 (Macintosh; Intel Mac OS X 10_14_6) AppleWebKit/537.36 (KHTML, like Gecko) Chrome/89.0.4389.90 Safari/537.36",2021-03-30 22:32:17.369,,2021-03-31 08:18:47.697,1,,,0,0,0,0,0,0,0,,
